Name,Location,Description,Year Established,UNESCO World Heritage Status,Unique Fact
Colosseum,"Rome, Italy","An oval amphitheatre in the centre of Rome, Italy. The largest ancient amphitheatre ever built, and still the largest standing amphitheater in the world today, despite its age.",70 AD,Yes,"The Colosseum could hold between 50,000 and 80,000 spectators and was used for gladiatorial contests and public spectacles."
Sagrada Familia,"Barcelona, Spain","A large unfinished Roman Catholic minor basilica in Barcelona, designed by Spanish architect Antoni Gaudí (1852–1926).",1882,Yes,"Gaudí's work on the building is part of a UNESCO World Heritage Site. Its construction is anticipated to be completed in 2026, the centenary of Gaudí's death."
Acropolis of Athens,"Athens, Greece",An ancient citadel on a rocky outcrop above the city of Athens. Contains the remains of several ancient buildings of great architectural and historic significance.,5th Century BC,Yes,"The Parthenon, the most famous building on the Acropolis, was dedicated to the goddess Athena, whom the people of Athens considered their patron."
Big Ben and the Houses of Parliament,"London, United Kingdom",The iconic national timepiece and the meeting place of the UK parliament. Big Ben is the nickname for the Great Bell of the clock at the north end of the Palace of Westminster.,1859,Not Applicable,"The tower was designed by Augustus Pugin in a neo-Gothic style. When completed in 1859, its clock was the largest and most accurate four-faced striking and chiming clock in the world."
Neuschwanstein Castle,"Bavaria, Germany","A 19th-century Romanesque Revival palace on a rugged hill above the village of Hohenschwangau near Füssen in southwest Bavaria, Germany.",1869,Not Applicable,"The palace was commissioned by Ludwig II of Bavaria as a retreat and as an homage to Richard Wagner, the King's inspiring muse."
Louvre Museum,"Paris, France","The world's largest art museum and a historic monument in Paris. Home to thousands of works of art, including the Mona Lisa and the Venus de Milo.",1793,Yes,"Originally built as a fortress by Philip II in 1190, the Louvre was transformed into a public museum during the French Revolution."
St. Basil's Cathedral,"Moscow, Russia","A world-famous landmark in Moscow, known for its colorful, onion-shaped domes, which has become a symbol of Russian culture.",1561,Not Applicable,The cathedral was built on the site of a previous building that was destroyed by fire during the capture of Moscow by the Crimean Tatars.
Stonehenge,"Wiltshire, United Kingdom","A prehistoric monument in Wiltshire, England. It consists of a ring of standing stones, each around 13 feet high, seven feet wide, and weighing around 25 tons.",3000 BC,Yes,"Stonehenge's exact purpose remains a mystery, with speculation ranging from human sacrifice to astronomy."
The Matterhorn,Border of Switzerland and Italy,"A mountain of the Alps, straddling the main watershed and border between Switzerland and Italy. It is one of the most famous and iconic peaks in the Alps.",Not Applicable,Not Applicable,The Matterhorn was one of the last great Alpine peaks to be climbed and its first ascent in 1865 marked the end of the golden age of alpinism.
