name,price (PLN),country,region,appellation,vineyard,vintage,volume (liters),alcohol (%),serving temperature (C),color,kind,taste,style,medals,wegan,natural,punctation,grapes
Terrai OVT Old Vine Tempranillo Carinena DO,46.0,Spain,Aragon,Carinena DO,Covinca,2019.0,0.75,,,red,,dry,,,False,False,,Tempranillo
"Terrai “OVG"" Old Vine Garnacha Carinena DO",42.0,Spain,Aragon,Carinena DO,Covinca,2020.0,0.75,,,red,,dry,,Bruxela Srebrny,False,False,,Garnacha
Terrazze della Luna Chardonnay Trentino DOC,51.0,Italy,Trentino Alto Adige,Trentino DOC,CAVIT Cantina Viticoltori del Trentino,2021.0,0.75,,12,white,,dry,average,,False,False,,Chardonnay
Terrazze della Luna Pinot Grigio Trentino DOC,51.0,Italy,Trentino Alto Adige,Trentino DOC,CAVIT Cantina Viticoltori del Trentino,2022.0,0.75,,,white,,dry,light,,False,False,,Pinot Grigio
Terrazze della Luna Rosato Pinot Grigio Vigneti Delle Dolomiti DOC,51.0,Italy,Trentino Alto Adige,Trentino DOC,CAVIT Cantina Viticoltori del Trentino,2020.0,0.75,,,rose,,dry,light,,False,False,,Pinot Grigio
Terrazze della Luna Teroldego Rotaliano Trentino DOC,51.0,Italy,Trentino Alto Adige,Trentino DOC,CAVIT Cantina Viticoltori del Trentino,2019.0,0.75,,,red,,dry,average,,False,False,,Teroldego
The Love Grass Shiraz d'Arenberg,109.0,Australia,,McLaren Valley,d'Arenberg,2019.0,0.75,14.5,16-18,red,,dry,full,,True,False,,Shiraz / Syrah
The Money Spider Roussanne d'Arenberg,95.0,Australia,,McLaren Valley,d'Arenberg,2018.0,0.75,13.0,10-12,white,,dry,average,,True,False,,Roussanne
The Stump Jump GSM d'Arenberg,69.0,Australia,,McLaren Valley,d'Arenberg,2017.0,0.75,14.5,16-18,red,,dry,average,,True,False,,Grenache
The Wine People Amori Prosecco Extra Dry DOC NV,64.0,Italy,Veneto,Prosecco DOC,,,0.75,11.0,8,,sparkling,semi-dry,light,,True,False,,Prosecco
The Wine People Denatile Nero d'Avola Shiraz Sicilia IGT,49.0,Italy,Sicily,Sicilia IGT,,2021.0,0.75,12.0,10-12,red,,dry,average,,False,False,,"Shiraz, Nero d'Avola"
The Wine People Proverbio Prosecco Extra Dry DOC NV,70.0,Italy,Veneto,Prosecco DOC,,,0.75,11.0,8,,sparkling,semi-dry,light,,True,True,,Prosecco
The Wine People Volunté Montepulciano d'Abruzzo DOC,50.0,Italy,Abruzzo,Montepulciano d Abruzzo DOC,,2020.0,0.75,12.5,16,red,,dry,average,,False,False,,Montepulciano d'Abruzzo
The Wine People Volunté Pinot Grigio Delle Venezie IGT,50.0,Italy,Veneto,Delle Venezie IGT,,2021.0,0.75,12.0,10,white,,dry,light,,True,False,,Pinot Grigio
The Witches Berry Chardonnay d'Arenberg,109.0,Australia,,McLaren Valley,d'Arenberg,2018.0,0.75,13.0,10-12,white,,dry,average,,True,False,,Chardonnay
Tinto Pesquera MXI Ribera del Duero DO,220.0,Spain,Ribera del Duero,Ribera del Duero DO,,2019.0,0.75,14.5,14,red,,dry,full,,False,False,,Tempranillo
Tinto Pesquera Reserva Ribera del Duero DO,268.0,Spain,Ribera del Duero,Ribera del Duero DO,,2018.0,0.75,14.0,14,red,,dry,full,,False,False,,Tempranillo
Tinto Quinta da Alorna,45.0,Portugal,Alentejo,Vinho Regional Tejo,Quinta Da Alorna,2019.0,0.75,13.5,16-18,red,,dry,average,,False,False,,"Alicante, Syrah, Castelao, Tinta Roriz, Alicante Bouschet"
Tinto Quinta da Alorna Magnum,85.0,Portugal,Alentejo,Vinho Regional Tejo,Quinta Da Alorna,2018.0,1.5,13.5,16-18,red,,dry,average,,False,False,,"Alicante, Alicante Bouschet, Castelao, Tinta Roriz"
Tokaji Aszu 3 puttonyos Hollokoi Mihaly,109.0,Hungary,Tokaj (Tokay-Hegyalja),Tokaji,Hollokoi Mihaly,2016.0,0.5,13.0,12,white,,sweet,full,,False,False,,Furmint
Tokaji Aszu 6 puttonyos Edes Hollokoi Mihaly,229.0,Hungary,Tokaj (Tokay-Hegyalja),Tokaji,Hollokoi Mihaly,2007.0,0.5,12.0,12,white,,sweet,full,,False,False,,Furmint
Tokaji Furmint Mandolas Oremus,177.0,Hungary,Tokaj (Tokay-Hegyalja),Tokaji,Oremus,2019.0,0.75,,9,white,,dry,average,,False,False,,Furmint
Tokaji Sargamuskotaly Semi Sweet / Feledes Hollokoi Mihaly,63.0,Hungary,Tokaj (Tokay-Hegyalja),Tokaji,Hollokoi Mihaly,2019.0,0.75,12.0,12,white,,semi-sweet,average,,False,False,,Sárgamuskotály
Tokaji Sargamuskotaly Szaraz Hollokoi Mihaly,55.0,Hungary,Tokaj (Tokay-Hegyalja),Tokaji,Hollokoi Mihaly,2018.0,0.75,15.5,12,white,,dry,average,,False,False,,Sárgamuskotály
Tokaji Szamorodni Hollokoi Mihaly,69.0,Hungary,Tokaj (Tokay-Hegyalja),Tokaji,Hollokoi Mihaly,2017.0,0.5,13.0,12,white,,sweet,full,,False,False,,Furmint
"Torrevento ""Ottagono""Castel del Monte Nero di Troia Riserva DOCG",181.0,Italy,Puglia,Castel del Monte DOCG,Torrevento,2015.0,,,,red,,dry,full,,False,False,,Nero di Troia
"Torrevento ""Vigna Pedale"" Nero di Troia Riserva Castel del Monte DOC",132.0,Italy,Puglia,Castel del Monte DOCG,Torrevento,2015.0,0.75,,,red,,dry,full,,False,False,,Nero di Troia
Torrevento Bolonero Rosso Castel del Monte DOC,76.0,Italy,Puglia,Castel del Monte DOC,Torrevento,2019.0,,,,red,,dry,full,,False,False,,"Nero di Troia, Aglianico"
Tradition La Ciboise Luberon Rouge AOP Chapoutier,57.0,France,Rhône Valley,Luberon AOP,Maison Michel Chapoutier,2021.0,0.75,13.0,16,red,,dry,,,False,False,,"Grenache, Shiraz / Syrah"
Traversa Cabernet Franc Montevideo,39.0,Uruguay,Montevideo,,,2020.0,0.75,12.5,16-18,red,,dry,average,,False,False,,Cabernet Franc
Traversa Noble Alianza Cabernet Franc-Tannat-Marselán Canelones,54.0,Uruguay,Canelones,,,2020.0,0.75,13.5,16-18,red,,dry,average,,False,False,,"Cabernet Franc, Marselán, Tannat"
Traversa Noble Alianza Marselán-Tannat-Merlot Canelones,53.0,Uruguay,Canelones,,,2020.0,0.75,13.5,16-18,red,,dry,average,,False,False,,"Merlot, Marselán, Tannat"
Traversa Tannat Montevideo,42.0,Uruguay,Montevideo,,,2020.0,0.75,12.5,16-18,red,,dry,average,,False,False,,Tannat
Traversa Viña Salort Cabernet Sauvignon Reserva Canelones,73.0,Uruguay,Canelones,,,2020.0,0.75,13.5,16-18,red,,dry,full,,False,False,,Cabernet Sauvignon
Traversa Viña Salort Tannat Reserva Canelones,73.0,Uruguay,Canelones,,,2018.0,0.75,13.5,16-18,red,,dry,full,,False,False,,Tannat
Tre Ripe Verdicchio Castelli di Jesi DOC Classico Superiore Pievalta,89.0,Italy,March,Verdicchio dei Castelli di Jesi DOC Classico Superiore,,2021.0,0.75,12.5,12,white,,dry,average,,False,False,,Verdicchio
Trebez Bianco Dario Princic,239.0,Italy,Friuli,Venezia Gulia IGT,Princic Dario,2014.0,0.75,13.0,14,white,,dry,average,,True,True,,"Sauvignon Blanc, Pinot Gris, Chardonnay"
Tricollis Cuvee Red Apátsági Pannonhalmi,75.0,Hungary,Pannonhalma,,Apátsági Pannonhalmi,2018.0,0.75,14.0,17,red,,dry,average,,False,False,,Cabernet Franc
"Trinchero ""Nobius"" Nebbiolo",199.0,Italy,Piedmont,,,2016.0,0.75,14.0,16-18,red,,dry,average,,False,True,,Nebbiolo
"Trinchero ""Runchet"" Freisa d'Asti DOC",175.0,Italy,Piedmont,Freisa d’Asti DOC,,2017.0,0.75,14.0,16-18,red,,dry,average,,False,True,,Freisa
"Trinchero ""Terra del Noce"" Barbera d'Asti Superiore DOCG",137.0,Italy,Piedmont,Barbera D Asti DOC,,2016.0,0.75,14.0,16-18,red,,dry,average,,False,True,,Barbera
"Trinchero ""Vigna del Noce"" Barbera d'Asti Superiore DOCG",218.0,Italy,Piedmont,Barbera D Asti DOC,,2016.0,0.75,14.5,18,red,,dry,average,,False,True,,Barbera
Two Hands Angels’Share Shiraz McLaren Vale,143.0,Australia,McLaren Vale,,Two Hands,2020.0,0.75,,,red,,dry,full,,False,False,,Shiraz
Two Hands Bella`s Garden Shiraz Barossa Valley,289.0,Australia,Barossa Valley,,Two Hands,2018.0,0.75,14.0,,red,,dry,full,,False,False,93.0,Shiraz
Two Hands Daves’s Block Shiraz McLaren Vale,439.0,Australia,McLaren Vale,,Two Hands,2019.0,0.75,,,red,,dry,full,,False,False,,Shiraz
Two Hands Gnarly Dudes Shiraz Barossa Valley,151.0,Australia,Barossa Valley,,Two Hands,2021.0,0.75,14.5,,red,,dry,full,,False,False,,Shiraz
Two Hands Holly Grail Shiraz Barossa Valley,477.0,Australia,Barossa Valley,,Two Hands,2016.0,0.75,,,red,,dry,full,,False,False,,Shiraz
Two Hands Sexy Beast Cabernet Sauvignon McLaren Vale,149.0,Australia,McLaren Vale,,Two Hands,2022.0,0.75,14.1,,red,,dry,full,,False,False,91.0,Cabernet Sauvignon
Two Hands The Boy Riesling Clare Valley,143.0,Australia,Clare Valley,,Two Hands,2021.0,0.75,12.5,,white,,dry,average,,False,False,,Riesling
Val d'Oca Ocabianca Frizzante Secco Colli Trevigiani IGT,49.0,Italy,Veneto,Colli Trevigiani IGT,,,0.75,11.5,8,,sparkling,dry,light,,True,False,,Prosecco
Val d'Oca Prosecco Extra Dry Treviso DOC Magnum,169.0,Italy,Veneto,Prosecco Treviso DOC,,,1.5,11.5,8,,sparkling,semi-dry,light,,True,False,,Prosecco
Val d'Oca Prosecco Nero Brut Superiore Valdobiadene DOCG NV,99.0,Italy,Veneto,Valdobbiadene Prosecco Superiore DOCG,,,0.75,11.5,8,,sparkling,dry,average,,True,False,,Prosecco
Val d'Oca Prosecco Rose Millesimato Extra Dry,69.0,Italy,Veneto,Prosecco Treviso DOC,,2020.0,0.75,11.5,8,,sparkling,dry,average,,False,False,,"Prosecco, Pinot Noir"
Val d'Oca Rive Di Santo Stefano Prosecco Superiore Valdobiadene DOCG NV,103.0,Italy,Veneto,Valdobbiadene Prosecco Superiore DOCG,,,0.75,11.5,8,,sparkling,dry,average,"Decanter Silver, IWC Silver",False,False,90.0,Prosecco
Vall Llach Embruix,202.0,Spain,Catalonia,Priorat DOQ,Viticultors del Priorat,2019.0,0.75,15.0,17,red,,dry,full,,False,False,,Cabernet Sauvignon
Valli Unite Alessandrino VdT,89.0,Italy,Piedmont,Vino da Tavola (VdT),,2021.0,0.75,13.0,10-12,red,,dry,average,,True,True,,"Dolcetto, Barbera, Croatina"
Valli Unite Diogene Dolcetto Colli Tortonesi DOC,99.0,Italy,Piedmont,Colli Tortonesi DOC,,2020.0,0.75,13.0,16,red,,dry,average,,True,True,,Dolcetto
Valli Unite Il Brut & The Beast Pet-Nat,125.0,Italy,Piedmont,,,2022.0,0.75,12.0,10-12,,sparkling,dry,light,,True,True,,"Cortese, Malvasia di Candia Aromatica"
Valli Unite Il Rosé & The Beast Pet-Nat,109.0,Italy,Piedmont,,,,0.75,12.0,10-12,,sparkling,dry,light,,True,True,,"Barbera, Cortese, Moscato, Dolcetto, Malvasia di Candia Aromatica"
Valli Unite Rosatea Pet-Nat,119.0,Italy,Piedmont,,,2021.0,0.75,12.0,10-12,,sparkling,dry,light,,True,True,,"Barbera, Moscato, Malvasia Bianca"
Valli Unite San Vito Timorasso Colli Tortonesi DOC,135.0,Italy,Piedmont,Colli Tortonesi DOC,,2016.0,0.75,14.5,10-12,white,,dry,full,,True,True,,Timorasso
Vega Sicilia Alión Ribera del Duero DO,642.0,Spain,Ribera del Duero,Ribera del Duero DO,,2018.0,0.75,15.0,16-18,red,,dry,full,,False,False,95.333336,Tempranillo
Velenosi Lacrima di Morro d'Alba DOC,71.0,Italy,March,Lacrima di Morro d'Alba DOC,,2021.0,0.75,13.5,7,red,,dry,average,,False,False,,Lacrima di Morro
Velenosi Rosso Piceno DOC,53.0,Italy,March,Rosso Piceno DOC,,2020.0,0.75,13.5,12-14,red,,dry,average,,False,False,,"Sangiovese, Montepulciano"
Velenosi Verdicchio dei Castelli di Jesi DOC,66.0,Italy,March,Verdicchio dei Castelli di Jesi DOC Classico Superiore,,2021.0,0.75,13.5,10-12,white,,dry,average,,False,False,,Verdicchio
Velenosi Villa Angela Chardonnay Marche IGT,66.0,Italy,March,Marche IGT,,2021.0,0.75,13.5,7,white,,dry,average,,False,False,,Verdicchio
Verdegar Vinho Verde DOC,29.9,Portugal,Minho - Vinho Verde,Vinho Verde DOC,Verdegar,,0.75,9.5,10,white,,semi-dry,light,,False,False,,"Arinto, Azal Branco, Loureiro, Trajadura"
Vertente Niepoort,125.0,Portugal,Douro,Douro DOC,Niepoort,2019.0,0.75,13.0,17,red,,dry,average,,True,False,,"Touriga Nacional, Tinta Amarela"
Victoria Ordóñez La Pasajera DO Rueda,75.0,Spain,Castile (Castilla y Leon),Rueda DO,,2021.0,0.75,13.0,10,white,,dry,average,,False,True,,Verdejo
Victoria Ordóñez Zetian Old Vines Tempranillo Ecológico VdT Castilla,57.0,Spain,Castile-La Mancha,Vino de la Tierra,,2020.0,0.75,13.0,14,red,,dry,average,,False,True,,Tempranillo
Vida Organica Malbec,69.0,Argentina,Mendoza,,Familia Zuccardi,2021.0,0.75,13.0,16,red,,dry,average,,False,True,,Malbec
Vida Organica Torrontes,69.0,Argentina,Mendoza,,Familia Zuccardi,2019.0,0.75,14.5,11,white,,dry,average,,True,True,,Torrontes
Vidigal 3 Autores Lisboa VR,49.0,Portugal,Lisbon,Vinho Regional Lisboa,,2019.0,0.75,13.0,16-18,red,,dry,average,,False,False,,"Castelao, Cabernet Sauvignon, Aragonez"
Vidigal Boa Noite Lisboa! Lisboa VR,59.0,Portugal,Lisbon,Vinho Regional Lisboa,,2018.0,0.75,14.0,16-18,red,,dry,average,,False,False,,"Syrah, Touriga Nacional"
Vidigal Porta 6 Branco Lisboa VR,44.0,Portugal,Lisbon,Vinho Verde DOC,,2021.0,0.75,12.5,7,white,,dry,average,,False,False,,"Chardonnay, Viosinho, Viognier, Arinto"
Vidigal Porta 6 Vinho Verde DOC,39.0,Portugal,Lisbon,Vinho Verde DOC,,2022.0,0.75,9.5,8,white,,dry,light,,False,False,,"Arinto, Loureiro, Trajadura"
Vidigal Reserva dos Amigos Lisboa VR,85.0,Portugal,Lisbon,Vinho Regional Lisboa,,2018.0,0.75,13.0,16-18,red,,dry,average,,False,False,,"Aragonez, Castelao, Tinta Miúda"
Vie di Romans Dessimis Pinot Grigio Friuli Isonzo DOC,233.0,Italy,Friuli,Friuli Isonzo DOC,Vie di Romans,2021.0,,,,white,,dry,full,,False,False,,
Vie di Romans Dolée Friuliano Friuli Isonzo DOC,205.0,Italy,Friuli,Friuli Isonzo DOC,Vie di Romans,2018.0,0.75,14.0,,white,,dry,average,,False,False,,Tokai Friulano
Vie di Romans Piere Sauvignon Blanc Friuli Isonzo DOC,185.0,Italy,Friuli,Isonzo DOC,Vie di Romans,2018.0,0.75,,,white,,dry,average,,False,False,,Sauvignon Blanc
Vignerons de Mancey Bourgogne Chardonnay AOC (BVV),111.0,France,Burgundy,Bourgogne AOC,,2020.0,0.75,12.5,12,white,,dry,average,,False,False,,Chardonnay
Vignerons de Mancey Les Classiques Mâcon Villages AOC (BVV),89.0,France,Burgundy,Mâcon Villages AOC,,2018.0,0.75,12.5,12,white,,dry,average,,False,False,,Chardonnay
Vigneti Canosini Tufarello Nero di Troia Puglia IGT,57.0,Italy,Puglia,,Vigneti Canosini,2019.0,0.75,,,red,,dry,average,,False,False,,Nero di Troia
Vigneti del Vulture Piano Del Cerro Aglianico Del Vulture DOC,132.0,Italy,Basilicata,Aglianico del Vulture DOC,Vigneti del Vulture,2019.0,0.75,,,red,,dry,full,,False,False,,Aglianico
Vigneti del Vulture Pipoli Aglianico Del Vulture DOC,58.0,Italy,Basilicata,Aglianico del Vulture DOC,Vigneti del Vulture,2020.0,0.75,,,red,,dry,average,,False,False,,Aglianico
Vigneti del Vulture Pipoli Bianco Basilicata IGT,51.0,Italy,Basilicata,,Vigneti del Vulture,2022.0,0.75,13.0,,white,,dry,light,,False,False,,"Fiano, Greco"
Vigneti del Vulture Pipoli Zero Aglianico del Vulture DOC,69.0,Italy,Basilicata,,Vigneti del Vulture,2018.0,0.75,,18,red,,dry,average,,False,False,,Aglianico
Vigneti del Vulture Sensuale Moscato Basilicata IGP,59.0,Italy,Basilicata,,Vigneti del Vulture,2022.0,0.75,10.0,,white,,semi-sweet,full,,False,False,,Moscato
Vigneti Massa Derthona Piemonte,179.0,Italy,Piedmont,,,2021.0,0.75,14.0,10,white,,dry,full,,False,True,,Timorasso
Vigneti Massa Montecitorio Colli Tortonesi DOC,369.0,Italy,Piedmont,Colli Tortonesi DOC,,2021.0,0.75,14.0,10,white,,dry,full,,False,True,,Timorasso
Vigneti Massa Piccolo Derthona Piemonte,119.0,Italy,Piedmont,,,2022.0,0.75,12.5,8-10,white,,dry,average,,False,True,,Timorasso
Vigneti Zabu Vanita Nero d'Avola Sicilia IGT BIO Cantine Cellaro,80.0,Italy,Sicily,Sicilia IGT,,2021.0,0.75,13.0,16,red,,dry,full,,True,True,,Nero d'Avola
Vigneti Zanatta Fieli Carignano Isola del Nuraghi IGT,79.0,Italy,Sardinia,Isola dei Nuraghi IGT,,2020.0,0.75,13.5,16-18,red,,dry,full,,False,False,,Carignano/Carignan
Vigneti Zanatta Le Saline Vermentino Di Gallura Superiore DOCG,159.0,Italy,Sardinia,Vermentino Di Gallura Superiore DOCG,,2020.0,0.75,14.0,10-12,white,,dry,full,,False,False,,Vermentino
Vigneti Zanatta Orion Vermentino Di Sardegna DOC,65.0,Italy,Sardinia,Vermentino Di Gallura Superiore DOCG,,2021.0,0.75,12.5,8,white,,dry,average,,False,False,,Vermentino
Vigneti Zanatta Renadoro Vermentino Di Gallura DOCG,79.0,Italy,Sardinia,Vermentino di Gallura DOCG,,2021.0,0.75,13.5,8,white,,dry,average,,False,False,,Vermentino
Vigneti Zanatta Salana Cannonau Di Sardegna DOC,79.0,Italy,Sardinia,Cannonau di Sardegna DOC,,2020.0,0.75,14.5,16-18,red,,dry,full,,False,False,,Cannonau
Vigneti Zanatta Tararà Cannonau Di Sardegna DOC,147.0,Italy,Sardinia,Cannonau di Sardegna DOC,,2017.0,0.75,14.5,16-18,red,,dry,full,,False,False,,Cannonau
Vigneto Bucerchiale Chianti Rufina DOCG Riserva Fattoria Selvapiana,199.0,Italy,Tuscany,Chianti Rufina DOCG,Fattoria Selvapiana,2013.0,0.75,14.5,16-18,red,,dry,full,,False,False,,Sangiovese
Vignoble Réveille Carpe IGP Côtes Catalanes,129.0,France,Roussillon,IGP Côtes Catalanes,,2021.0,0.75,12.5,8-10,white,,dry,average,,True,True,,"Grenache Gris, Marsanne"
Vignoble Réveille Franc Tireur IGP Côtes Catalanes,155.0,France,Roussillon,IGP Côtes Catalanes,,2021.0,0.75,13.0,8-10,red,,dry,average,,True,True,,Carignan
Vignoble Réveille Herbes Folles IGP Côtes Catalanes,99.0,France,Roussillon,IGP Côtes Catalanes,,2020.0,0.75,12.5,8-10,rose,,dry,average,,True,True,,Syrah
VIK 'A' Cabernet Sauvignon Valle de Cachapoal DO,179.0,Chile,Cachapoal,Valle de Cachapoal DO,,2020.0,0.75,14.0,16,red,,dry,full,,False,True,,Cabernet Sauvignon
VIK 'Vik' Valle de Cachapoal DO,859.0,Chile,Cachapoal,Valle de Cachapoal DO,,2017.0,0.75,14.5,16,red,,dry,full,,False,True,96.0,"Cabernet Sauvignon, Cabernet Franc"
VIK La Piu Belle Valle de Cachapoal DO,499.0,Chile,Cachapoal,Valle de Cachapoal DO,,2018.0,0.75,14.5,15,red,,dry,full,,False,True,,"Cabernet Sauvignon, Carmenere, Merlot, Syrah"
VIK Milla Cala Valle de Cachapoal DO,269.0,Chile,Cachapoal,Valle de Cachapoal DO,,2019.0,0.75,14.5,16,red,,dry,full,,False,True,94.0,"Cabernet Sauvignon, Carmenere, Syrah, Merlot, Cabernet Franc"
Villa Antinori Bianco IGT Toscana,96.0,Italy,Tuscany,Toscana IGT,,2022.0,0.75,12.0,8-10,white,,dry,average,,False,False,,"Pinot Bianco, Trebbiano, Malvasia Bianca, Pinot Grigio"
Villa Antinori Rosso IGT Toscana,142.0,Italy,Tuscany,Toscana IGT,,2020.0,0.75,13.5,15,red,,dry,average,,False,False,,"Cabernet Sauvignon, Syrah, Sangiovese, Merlot"
Villa Diana Montepulciano d`Abruzzo DOC,44.0,Italy,Abruzzo,Montepulciano d Abruzzo DOC,Feudo Antico,2022.0,0.75,,,red,,dry,,,False,False,,Montepulciano
Villa Diana Trebbiano d`Abruzzo DOC,44.0,Italy,Abruzzo,Trebbiano D’Abruzzo DOC,Feudo Antico,2021.0,0.75,12.5,,white,,dry,,,False,False,,Trebbiano
Villa Dria Cleuf de Sol Côtes de Gascogne IGP,49.0,France,Southwest France,Côtes de Gascogne IGP,,2021.0,0.75,11.5,16-18,red,,dry,average,,False,False,,"Merlot, Cabernet Sauvignon"
Villa Dria Côte Sauvage Côtes de Gascogne IGP,47.0,France,Southwest France,Côtes de Gascogne IGP,,2021.0,0.75,11.5,10,white,,dry,average,,False,False,,"Colombard, Sauvignon Blanc"
Villa Dria Fleur des Fées Rosé Côtes de Gascogne IGP,47.0,France,Southwest France,Côtes de Gascogne IGP,,2021.0,0.75,11.0,10,rose,,dry,average,,False,False,,"Cabernet Franc, Merlot"
Villa Dria Lune de Miel Côtes de Gascogne IGP,69.0,France,Southwest France,Côtes de Gascogne IGP,,2020.0,0.75,11.5,10,white,,sweet,average,,False,False,,Gros Manseng
Villa Dria Terre de Feu Côtes de Gascogne IGP,49.0,France,Southwest France,Côtes de Gascogne IGP,,2020.0,0.75,12.0,10,white,,dry,average,,False,False,,"Gros Manseng, Chardonnay"
Villa Huesgen Riesling Alte Reben Enkircher Steffensberg Mosel Qba,219.0,Germany,Moselle-Saar-Ruwer,Mosel QbA,,2020.0,0.75,10.5,10-12,white,,dry,full,Decanter Gold,False,False,,Riesling
Villa Huesgen Riesling by the glass Mosel Qba,85.0,Germany,Moselle-Saar-Ruwer,Mosel QbA,,2021.0,0.75,11.0,10-12,white,,dry,average,,False,False,,Riesling
Villa Huesgen Riesling Schiefer Mosel Qba,149.0,Germany,Moselle-Saar-Ruwer,Mosel QbA,,2020.0,0.75,11.0,10-12,white,,dry,average,,False,False,,Riesling
Villa Maria Private Bin Blush Sauvignon Marlborough,103.0,New Zealand,Marlborough,,,2020.0,0.75,12.0,10,rose,,dry,light,,False,False,,"Sauvignon Blanc, Merlot"
Villa Maria Private Bin Pinot Noir Marlborough,116.0,New Zealand,Marlborough,,,2020.0,0.75,12.0,16,red,,dry,average,Decanter Bronze,False,False,,Pinot Noir
Villa Maria Private Bin Riesling Marlborough,99.0,New Zealand,Marlborough,,,2021.0,0.75,12.0,10,white,,dry,light,Decanter Silver,False,False,,Riesling
Villa Maria Private Bin Sauvignon Blanc Marlborough,99.0,New Zealand,Marlborough,,,2021.0,0.75,13.0,10,white,,dry,average,Decanter Bronze,False,True,,Sauvignon Blanc
Villa Maria Private Bin Syrah Hawkes Bay,112.0,New Zealand,Hawkes Bay,,,2019.0,0.75,12.0,16,red,,dry,average,,False,False,,Syrah
Villa Maria Reserve Chardonnay Hawkes Bay,136.0,New Zealand,Hawkes Bay,,,2016.0,0.75,13.5,10-12,white,,dry,full,,False,False,,Chardonnay
Villa Maria Reserve Pinot Noir Marlborough,169.0,New Zealand,Marlborough,,,2018.0,0.75,12.5,16,red,,dry,average,,False,False,,Pinot Noir
Villa Maria Seddon Pinot Noir Marlborough,239.0,New Zealand,Marlborough,,,2014.0,0.75,12.5,16,red,,dry,average,,False,False,,Pinot Noir
Villa Russiz Pinot Blanc Collio DOC,125.1,Italy,Friuli,Collio DOC,Villa Russiz,2018.0,0.75,13.5,,white,,dry,average,,False,False,,Pinot Bianco
Villa Russiz Sauvignon Blanc Collio DOC,125.1,Italy,Friuli,Collio DOC,Villa Russiz,2018.0,0.75,13.5,,white,,dry,average,,False,False,,Sauvignon Blanc
Villa Wolf Gewurztraminer,54.0,Germany,,,Ernst Loosen,2022.0,0.75,12.0,10-12,white,,dry,,,True,False,,Gewürztraminer
Villa Wolf Pinot Gris Pfalz,54.0,Germany,,,Villa Wolf,2022.0,0.75,,,white,,dry,average,,False,False,,Pinot Gris
Villa Wolf Pinot Noir Pfalz,60.0,Germany,Pfalz,,Villa Wolf,2022.0,0.75,,,red,,dry,light,,False,False,,Pinot Noir
Villa Wolf Pinot Noir Rose Pfalz,54.0,Germany,Pfalz,,Villa Wolf,2020.0,0.75,,,rose,,semi-dry,light,,False,False,,Pinot Noir
Villa Wolf Pinot Noir Rose Sekt Extra Dry,78.0,Germany,Pfalz,,Villa Wolf,,0.75,,,,sparkling,,,,False,False,,Pinot Noir
Villa Wolf Riesling Trocken Pfalz,54.0,Germany,Pfalz,,Villa Wolf,2022.0,0.75,12.5,,white,,dry,light,,False,False,,Riesling
Viña Ilusion Joven Rioja DOC,69.0,Spain,Rioja,Rioja DOC,,2018.0,0.75,13.5,15,red,,dry,average,,True,True,,"Cabernet Sauvignon, Graciano, Tempranillo, Garnacha"
Viña Ilusion Prana Rioja DOC,69.0,Spain,Rioja,Rioja DOC,,2019.0,0.75,13.5,16,red,,dry,average,,True,True,,"Cabernet Sauvignon, Graciano, Tempranillo, Garnacha"
Viña Sastre Crianza Ribera Del Duero DO,144.0,Spain,Castile (Castilla y Leon),Ribera del Duero DO,,2019.0,0.75,15.0,16-18,red,,dry,full,,False,True,,Tempranillo
Viña Sastre Roble Ribera Del Duero DO,79.0,Spain,Castile (Castilla y Leon),Ribera del Duero DO,,2021.0,0.75,14.0,16,red,,dry,average,,False,True,,Tempranillo
Vina Tondonia Reserva Lopez de Heredia Rioja DOC,304.0,Spain,,Rioja DOC,R. LÓPEZ DE HEREDIA,2008.0,0.75,13.0,18,red,,dry,average,,False,False,93.333336,"Tempranillo, Graciano, Garnacha, Mazuelo"
Vina Zorzal El Inquilino Crianza DOCa Rioja,74.0,Spain,Rioja,Rioja DOC,,2019.0,0.75,14.0,15,red,,dry,average,,False,False,,Tempranillo
Vina Zorzal El Inquilino Viura DOCa Rioja,74.0,Spain,Rioja,Rioja DOC,,2019.0,0.75,13.0,8-10,white,,dry,average,,False,False,,Viura
Viñedos de Nieva Sauvignon Blanc DO Rueda,59.0,Spain,Castile (Castilla y Leon),Rueda DO,,2021.0,0.75,,8,white,,dry,,,False,False,,
Viñedos de Nieva Verdejo DO Rueda,55.0,Spain,Castile (Castilla y Leon),Rueda DO,,2021.0,0.75,12.0,8,white,,dry,light,,False,False,90.0,Verdejo
Vino Nobile di Montepulciano Asinone Poliziano Magnum,595.0,Italy,Tuscany,V.Nobile di Montepulciano DOCG,Poliziano,2018.0,0.75,,18,red,,dry,full,,False,False,,Sangiovese
Vino Nobile di Montepulciano Boscarelli,187.0,Italy,Tuscany,V.Nobile di Montepulciano DOCG,Boscarelli,2018.0,0.75,14.0,16,red,,dry,full,,False,False,90.0,"Canaiolo, Sangiovese, Colorino"
Vino Nobile di Montepulciano Poliziano,189.0,Italy,Tuscany,V.Nobile di Montepulciano DOCG,Poliziano,2019.0,0.75,14.5,17,red,,dry,average,,False,False,90.0,Sangiovese
Vino Nobile di Montepulciano Poliziano magnum,379.0,Italy,Tuscany,V.Nobile di Montepulciano DOCG,Poliziano,2018.0,1.5,14.0,17,red,,dry,average,,False,False,91.5,Sangiovese
Vino Nobile di Montepulciano Riserva Boscarelli,214.0,Italy,Tuscany,V.Nobile di Montepulciano DOCG,Boscarelli,2016.0,0.75,14.0,16-18,red,,dry,full,,False,False,92.0,"Colorino, Sangiovese"
Vinya Alforí PURE EST Monastrell Valencia DO BIO,55.0,Spain,Valencia,Valencia DOP,,2021.0,0.75,13.5,15,red,,dry,average,,True,True,,Monastrell
Vinya Alforí PURE EST Tempranillo Valencia DO BIO,53.0,Spain,Valencia,Valencia DOP,,2021.0,0.75,13.5,15,red,,dry,average,,True,True,,Tempranillo
Vinya Alforí PURE EST Verdejo Valencia DO BIO,53.0,Spain,Valencia,Valencia DOP,,2022.0,0.75,12.0,16,white,,dry,light,,True,True,,Verdejo
Voyeur Mulato Tinto Niepoort,149.0,Portugal,Douro,Douro DOC,Niepoort,2019.0,1.0,13.0,14,red,,dry,average,,True,True,,"Tinta Roriz, Tinta Amarela, Malvasia Bianca"
Weiss Genuss Auer,59.0,Austria,,Thermenregion,Auer,2021.0,0.75,11.0,10-12,white,,semi-dry,light,,False,True,,Welschriesling
Weisser Burgunder Wittmann,75.0,Germany,Rheinhessen,,Wittmann,2020.0,0.75,,,white,,dry,average,,False,True,,Pinot Blanc
Weninger Blaufränkisch Burgenland,111.0,Austria,Burgenland,,,2018.0,0.75,12.0,15,red,,dry,average,,False,True,,Blaufränkisch
Weninger Blaufränkisch Hochäcker Burgenland,139.0,Austria,Burgenland,,,2018.0,0.75,12.5,16-18,red,,dry,average,,False,True,,Blaufränkisch
Weninger Fehérburgundi Sopron,139.0,Hungary,Sopron,,,2021.0,0.75,12.0,10,white,,dry,average,,False,True,,Pinot Blanc
Weninger Kékfrankos Balf Sopron,111.0,Hungary,Sopron,,,2019.0,0.75,12.5,16-18,red,,dry,average,,False,True,,Kekfrankos
Weninger Ponzichter Burgenland/Sopron,129.0,Austria,Burgenland,,,2019.0,0.75,12.0,15,red,,dry,average,,False,True,,"Pinot Noir, Zweigelt, Cabernet Franc, Blaufränkisch"
Weninger Rózsa Petsovits Burgenland,119.0,Austria,Burgenland,,,2021.0,0.75,12.0,12-14,rose,,dry,average,,False,True,,"Pinot Noir, Syrah, Zweigelt, Blaufränkisch"
Whistling Duck Sauvignon Blanc Semillon Riverina,51.0,Australia,Riverine,,Calabria Family Wines,2021.0,0.75,,12,white,,dry,,,False,False,,
Whistling Duck Shiraz Riverina,51.0,Australia,Riverine,,Calabria Family Wines,2020.0,0.75,,16-18,red,,dry,,,False,False,,Shiraz
Winnica Chodorowa Johanniter Małopolska,79.0,Poland,Lesser Poland,,,2020.0,0.75,12.5,8-10,white,,dry,average,,False,False,,Johanniter
Winnica Chodorowa Wino Musujące Małopolska,105.0,Poland,Lesser Poland,,,2018.0,0.75,11.5,8-10,,sparkling,dry,average,,False,False,,
